[
  {
    "id": "C001",
    "location": { "section": "2. Single-arm phase II evidence for pembrolizumab + platinum-doublet", "paragraph": 1, "line": null },
    "claim_verbatim": "Smith et al. reported a 12-month progression-free survival rate of **47.3%** (95% CI 38.1–55.9%) in their single-center investigator-initiated trial, exceeding the prespecified 40% threshold (Smith 2024).",
    "claim_type": "citation_bearing",
    "citations": [
      { "key": "Smith 2024", "doi": "10.0001/jtor.fixture.smith2024", "pmid": null, "raw_text": "Smith JR, Patel A, Ng S, Williams T, Okafor C, Lee H, et al. Pembrolizumab plus carboplatin/pemetrexed in PD-L1–high advanced non-squamous NSCLC: a single-center phase II investigator-initiated study. *Journal of Thoracic Oncology Reports* 2024; 12(4): 287-301. DOI: 10.0001/jtor.fixture.smith2024" }
    ],
    "verification_path": [
      { "method": "abstract_check", "tool": "user-provided source", "query": "12-month PFS 47.3% threshold", "result_summary": "Source abstract states '12-month progression-free survival rate was 47.3% (95% CI 38.1–55.9%)' and conclusions state 'exceeding the prespecified 40% threshold'. Direct match." },
      { "method": "doi_lookup", "tool": "intake.cited_papers source_meta.json", "query": "10.0001/jtor.fixture.smith2024", "result_summary": "Fixture DOI (10.0001/* reserved for examples; does not resolve online). Local source_meta.json provides canonical record per Stage 6 cooperation contract." }
    ],
    "evidence": [
      { "source": "smith2024_pembro_nsclc.txt (user-provided full text)", "url": "regression/sources/smith2024_pembro_nsclc/smith2024_pembro_nsclc.txt", "snippet": "the 12-month progression-free survival rate was 47.3% (95% CI 38.1–55.9%)" },
      { "source": "smith2024_pembro_nsclc_stats.json (claim_id C-03)", "url": "regression/sources/smith2024_pembro_nsclc/smith2024_pembro_nsclc_stats.json", "snippet": "12-month progression-free survival rate was 47.3% (95% CI 38.1–55.9%)" }
    ],
    "verdict": "VERIFIED",
    "severity": "INFORMATIONAL",
    "recommended_action": "No action required; PFS rate, CI, and 40% threshold framing all match the cited source.",
    "confidence": "high"
  },
  {
    "id": "C002",
    "location": { "section": "2. Single-arm phase II evidence for pembrolizumab + platinum-doublet", "paragraph": 1, "line": null },
    "claim_verbatim": "12-month progression-free survival rate of **47.3%** (95% CI 38.1–55.9%)",
    "claim_type": "numerical",
    "verification_path": [
      { "method": "abstract_check", "tool": "stats.json (research-paper-summarizer cooperation)", "query": "claim_id C-03", "result_summary": "stats.json claim_id C-03 records value=47.3, unit=%, context='12-month progression-free survival rate was 47.3% (95% CI 38.1–55.9%)'. Exact match to document." },
      { "method": "abstract_check", "tool": "user-provided source", "query": "verbatim 47.3% 95% CI 38.1-55.9%", "result_summary": "Source abstract and Results §3.2 both state '47.3% (95% CI 38.1–55.9%)'. Verbatim match." }
    ],
    "evidence": [
      { "source": "smith2024_pembro_nsclc_stats.json (C-03)", "url": "regression/sources/smith2024_pembro_nsclc/smith2024_pembro_nsclc_stats.json", "snippet": "value=47.3, unit=%; context: 12-month progression-free survival rate was 47.3% (95% CI 38.1–55.9%)" }
    ],
    "verdict": "VERIFIED",
    "severity": "INFORMATIONAL",
    "recommended_action": "No action required.",
    "confidence": "high"
  },
  {
    "id": "C003",
    "location": { "section": "2. Single-arm phase II evidence for pembrolizumab + platinum-doublet", "paragraph": 1, "line": null },
    "claim_verbatim": "exceeding the prespecified 40% threshold",
    "claim_type": "numerical",
    "verification_path": [
      { "method": "abstract_check", "tool": "user-provided source", "query": "prespecified 40% threshold", "result_summary": "Source Abstract Conclusions: 'exceeding the prespecified 40% threshold'. Verbatim match." }
    ],
    "evidence": [
      { "source": "smith2024_pembro_nsclc.txt Abstract Conclusions", "url": "regression/sources/smith2024_pembro_nsclc/smith2024_pembro_nsclc.txt", "snippet": "exceeding the prespecified 40% threshold" }
    ],
    "verdict": "VERIFIED",
    "severity": "INFORMATIONAL",
    "recommended_action": "No action required.",
    "confidence": "high"
  },
  {
    "id": "C004",
    "location": { "section": "2. Single-arm phase II evidence for pembrolizumab + platinum-doublet", "paragraph": 2, "line": null },
    "claim_verbatim": "**210 patients** were enrolled with previously untreated PD-L1–high disease between January 2022 and November 2023 (Smith 2024).",
    "claim_type": "numerical",
    "citations": [
      { "key": "Smith 2024", "doi": "10.0001/jtor.fixture.smith2024", "pmid": null, "raw_text": "Smith JR, Patel A, Ng S, Williams T, Okafor C, Lee H, et al. Pembrolizumab plus carboplatin/pemetrexed in PD-L1–high advanced non-squamous NSCLC: a single-center phase II investigator-initiated study. *Journal of Thoracic Oncology Reports* 2024; 12(4): 287-301. DOI: 10.0001/jtor.fixture.smith2024" }
    ],
    "verification_path": [
      { "method": "abstract_check", "tool": "stats.json (research-paper-summarizer cooperation)", "query": "claim_id C-01 sample_size", "result_summary": "stats.json claim_id C-01 records value=187, unit=patients, stat_type=sample_size, context='We enrolled 187 patients with previously untreated PD-L1–high (TPS ≥ 50%) advanced non-squamous NSCLC'. Document asserts 210 patients — conflict of 23 patients (12.3% overcount)." },
      { "method": "abstract_check", "tool": "user-provided source (Methods/Results §3.1)", "query": "patients enrolled 210 vs 187", "result_summary": "Source Abstract Methods: 'We enrolled 187 patients ... between January 2022 and November 2023.' Source Results §3.1 restates 187. No mention of 210 anywhere in the paper. The document's '210 patients' directly contradicts the cited source." }
    ],
    "evidence": [
      { "source": "smith2024_pembro_nsclc.txt Abstract Methods", "url": "regression/sources/smith2024_pembro_nsclc/smith2024_pembro_nsclc.txt", "snippet": "We enrolled 187 patients with previously untreated PD-L1–high (TPS ≥ 50%) advanced non-squamous NSCLC between January 2022 and November 2023" },
      { "source": "smith2024_pembro_nsclc_stats.json (C-01)", "url": "regression/sources/smith2024_pembro_nsclc/smith2024_pembro_nsclc_stats.json", "snippet": "value=187, unit=patients, stat_type=sample_size" }
    ],
    "verdict": "CONTRADICTED",
    "severity": "CRITICAL",
    "recommended_action": "Replace '210 patients' with '187 patients' to match the cited source (Smith 2024 Abstract Methods and Results §3.1; stats.json C-01). The enrollment window (January 2022 — November 2023) is correct as written.",
    "confidence": "high"
  },
  {
    "id": "C005",
    "location": { "section": "2. Single-arm phase II evidence for pembrolizumab + platinum-doublet", "paragraph": 2, "line": null },
    "claim_verbatim": "between January 2022 and November 2023",
    "claim_type": "numerical",
    "verification_path": [
      { "method": "abstract_check", "tool": "user-provided source", "query": "enrollment dates", "result_summary": "Source Abstract Methods: 'between January 2022 and November 2023'. Verbatim match." }
    ],
    "evidence": [
      { "source": "smith2024_pembro_nsclc.txt Abstract Methods", "url": "regression/sources/smith2024_pembro_nsclc/smith2024_pembro_nsclc.txt", "snippet": "between January 2022 and November 2023" }
    ],
    "verdict": "VERIFIED",
    "severity": "INFORMATIONAL",
    "recommended_action": "No action required.",
    "confidence": "high"
  },
  {
    "id": "C006",
    "location": { "section": "2. Single-arm phase II evidence for pembrolizumab + platinum-doublet", "paragraph": 2, "line": null },
    "claim_verbatim": "The reported median PFS of 11.2 months substantially exceeds the historical 7.7-month median for pembrolizumab monotherapy",
    "claim_type": "numerical",
    "citations": [
      { "key": "Smith 2024", "doi": "10.0001/jtor.fixture.smith2024", "pmid": null, "raw_text": "Smith JR, Patel A, Ng S, Williams T, Okafor C, Lee H, et al. Pembrolizumab plus carboplatin/pemetrexed in PD-L1–high advanced non-squamous NSCLC: a single-center phase II investigator-initiated study. *Journal of Thoracic Oncology Reports* 2024; 12(4): 287-301. DOI: 10.0001/jtor.fixture.smith2024" }
    ],
    "verification_path": [
      { "method": "abstract_check", "tool": "stats.json (C-02, C-06)", "query": "median PFS 11.2 months; historical 7.7", "result_summary": "stats.json C-02 records value=11.2, unit=months, stat_type=median (Median PFS). stats.json C-06 records value=7.7, unit=months (historical median PFS for pembrolizumab monotherapy). Both numbers match document." },
      { "method": "abstract_check", "tool": "user-provided source", "query": "median PFS 11.2 historical 7.7", "result_summary": "Source Abstract Results: 'Median PFS was 11.2 months (95% CI 8.4–14.7) ... historical median PFS of 7.7 months for pembrolizumab monotherapy'. Direct match." }
    ],
    "evidence": [
      { "source": "smith2024_pembro_nsclc.txt Abstract Results", "url": "regression/sources/smith2024_pembro_nsclc/smith2024_pembro_nsclc.txt", "snippet": "Median PFS was 11.2 months (95% CI 8.4–14.7) ... historical median PFS of 7.7 months for pembrolizumab monotherapy" },
      { "source": "smith2024_pembro_nsclc_stats.json (C-02, C-06)", "url": "regression/sources/smith2024_pembro_nsclc/smith2024_pembro_nsclc_stats.json", "snippet": "C-02 value=11.2 months median; C-06 value=7.7 months historical median" }
    ],
    "verdict": "VERIFIED",
    "severity": "INFORMATIONAL",
    "recommended_action": "No action required.",
    "confidence": "high"
  },
  {
    "id": "C007",
    "location": { "section": "2. Single-arm phase II evidence for pembrolizumab + platinum-doublet", "paragraph": 2, "line": null },